{
  "$schema": "https://json-schema.org/draft/2020-12/schema",
  "title": "NookBit Single-Condition Rule Tree",
  "type": "object",
  "additionalProperties": false,
  "required": ["schemaVersion", "ruleSetId", "version", "nodes"],
  "properties": {
    "schemaVersion": { "const": 3 },
    "ruleSetId": { "type": "string", "pattern": "^[a-zA-Z0-9._-]+$" },
    "version": { "type": "string", "format": "date-time" },
    "nodes": { "type": "array", "items": { "$ref": "#/$defs/node" } },
    "globalOtherwise": { "$ref": "#/$defs/destination" }
  },
  "$defs": {
    "node": {
      "type": "object",
      "additionalProperties": false,
      "required": ["id", "enabled"],
      "properties": {
        "id": { "type": "string", "pattern": "^[a-zA-Z0-9._-]+$" },
        "enabled": { "type": "boolean" },
        "otherwise": { "const": true },
        "when": { "$ref": "#/$defs/condition" },
        "destination": { "$ref": "#/$defs/destination" },
        "exclude": { "const": true },
        "children": { "type": "array", "items": { "$ref": "#/$defs/node" } }
      }
    },
    "condition": {
      "type": "object",
      "additionalProperties": false,
      "required": ["type"],
      "properties": {
        "type": { "enum": ["extension", "nameContains", "size", "modifiedAgeDays", "itemType"] },
        "kind": { "enum": ["file", "folder"] },
        "values": {
          "type": "array", "minItems": 1, "uniqueItems": true,
          "items": { "type": "string", "pattern": "^[a-zA-Z0-9]+$" }
        },
        "text": { "type": "string", "minLength": 1 },
        "comparison": { "enum": ["greaterThan", "atLeast", "lessThan", "atMost"] },
        "bytes": { "type": "integer", "minimum": 0 },
        "days": { "type": "integer", "minimum": 0 }
      }
    },
    "destination": {
      "type": "object",
      "additionalProperties": false,
      "required": ["path", "collisionPolicy"],
      "oneOf": [
        {
          "properties": {
            "base": { "const": "home" },
            "path": { "not": { "pattern": "(^[A-Za-z]:)|(^[/\\\\])|(^|[/\\\\])\\.\\.([/\\\\]|$)" } }
          }
        },
        {
          "required": ["base"],
          "properties": {
            "base": { "const": "absolute" },
            "path": { "pattern": "(^[A-Za-z]:[/\\\\])|(^/)", "not": { "pattern": "(^|[/\\\\])\\.\\.([/\\\\]|$)" } }
          }
        }
      ],
      "properties": {
        "base": { "enum": ["home", "absolute"] },
        "path": {
          "type": "string", "minLength": 1
        },
        "collisionPolicy": { "enum": ["inherit", "rename", "skip", "abort"] }
      }
    }
  }
}
